{
    "work_order_id":  "WO-B35-HYDRATE-GATE-001",
    "status":  "completed",
    "summary":  "已完成 hydrate 闸门补强：work_order 默认返回字段升级为 v2，dispatch_message_raw 兜底改为稳定中文提示；return_packet hydrate 补齐 v2 结构字段兜底。",
    "changed_files":  [
                          "skills/global-task-orchestrator/scripts/ensure-work-order-fields.ps1",
                          "skills/global-task-orchestrator/scripts/ensure-return-packet-fields.ps1"
                      ],
    "planned_files_not_changed":  [

                                  ],
    "verification_commands":  [
                                  "Select-String -Path \u0027C:\\Users\\72385\\dev\\ai-harness\\skills\\global-task-orchestrator\\scripts\\ensure-work-order-fields.ps1\u0027 -Pattern \u0027read_paths_mandatory\u0027,\u0027evidence_summary\u0027,\u0027中文\u0027,\u0027主协调器不得代写\u0027,\u0027planned_files_not_changed\u0027,\u0027verification_commands\u0027 -SimpleMatch",
                                  "Select-String -Path \u0027C:\\Users\\72385\\dev\\ai-harness\\skills\\global-task-orchestrator\\scripts\\ensure-return-packet-fields.ps1\u0027 -Pattern \u0027planned_files_not_changed\u0027,\u0027verification_commands\u0027,\u0027verification_result\u0027,\u0027deviations_from_dispatch\u0027,\u0027blocked_by\u0027,\u0027follow_up_needed\u0027 -SimpleMatch"
                              ],
    "verification_result":  "两条关键字校验命令均命中目标字段与文案。",
    "deviations_from_dispatch":  [

                                 ],
    "blocked_by":  [

                   ],
    "risks":  [
                  "本次仅执行了工单要求的关键字校验，未额外执行端到端 hydrate 流程回归。"
              ],
    "follow_up_needed":  [
                             "由主协调器汇总并与并行子代理对 validate-control-plane 的改动一起做最终集成验收。"
                         ],
    "written_by":  "subagent-b35-hydrate-gate-hardener",
    "written_role":  "hydrate-gate-hardener",
    "return_packet_id":  "RP-B35-HYDRATE-GATE-001",
    "task_id":  "contract-first-dispatch-batch3-4-20260403-153206-gtm2",
    "verification":  [

                     ],
    "next_actions":  [

                     ]
}
