{
    "return_packet_id":  "RP-P1-ROLE-NORMALIZATION-001",
    "task_id":  "codex-fixed-subagent-delegation-20260407-145034-kewd",
    "work_order_id":  "WO-P1-ROLE-NORMALIZATION-001",
    "status":  "completed",
    "summary":  "已在阶段1允许范围内完成角色层规范化：冻结 README 与 schema 的统一口径，并将 6 个角色文件对齐到统一输入/输出、停止条件与协作交接门禁。",
    "changed_files":  [
                          "agents/README.md",
                          "agents/_schema.example.md",
                          "agents/planner.md",
                          "agents/doc-curator.md",
                          "agents/test-verifier.md",
                          "agents/backend-implementer.md",
                          "agents/frontend-implementer.md",
                          "agents/ops-runbook.md"
                      ],
    "planned_files_not_changed":  [

                                  ],
    "verification_commands":  [
                                  "rg -n \"^## (角色目标|负责范围|不负责|输入|输出|工作规则|停止条件|协作交接)$|frozen_plan|work_order|主协调器验收\" agents/planner.md agents/doc-curator.md agents/test-verifier.md agents/backend-implementer.md agents/frontend-implementer.md agents/ops-runbook.md",
                                  "powershell: 逐文件结构检查（8 段标题完整性）",
                                  "powershell: 逐文件字段检查（frozen_plan/work_order 同时存在）",
                                  "powershell: 逐文件门禁检查（包含主协调器验收语义）"
                              ],
    "verification_result":  {
                                "role_files_keep_8_sections":  true,
                                "all_role_inputs_include_frozen_plan_and_work_order":  true,
                                "all_role_files_include_main_coordinator_acceptance_gate":  true,
                                "stage2_mapping_file_touched":  false,
                                "write_scope_violation_detected":  false
                            },
    "deviations_from_dispatch":  [

                                 ],
    "blocked_by":  [

                   ],
    "risks":  [
                  "当前目录不是 git 仓库，无法使用 git status/diff 做越界改动自动校验；本次通过写入范围约束与逐文件核对控制风险。"
              ],
    "follow_up_needed":  [
                             "阶段2（agents/codex-role-map.json）需在后续独立工单实施，不在本次阶段1范围内。"
                         ],
    "written_by":  "doc-curator",
    "written_role":  "doc-curator"
}
