{
    "return_packet_id":  "RP-P2-ROLE-MAP-FREEZE-001",
    "task_id":  "codex-fixed-subagent-delegation-20260407-145034-kewd",
    "work_order_id":  "WO-P2-ROLE-MAP-FREEZE-001",
    "status":  "completed",
    "summary":  "已完成阶段2角色映射层冻结：新增 agents/codex-role-map.json 并覆盖 8 个角色到 default/explorer/worker 的稳定映射，同时同步 README、兼容文档与治理文档的职责边界与调度顺序。",
    "changed_files":  [
                          "agents/codex-role-map.json",
                          "agents/README.md",
                          "docs/CODEX_COMPAT.md",
                          "docs/SUBAGENT_GOVERNANCE.md"
                      ],
    "planned_files_not_changed":  [

                                  ],
    "verification_commands":  [
                                  "powershell: 解析 agents/codex-role-map.json，校验 8 角色覆盖与 agent_type 枚举",
                                  "rg -n \"codex-role-map|先选角色|角色语义真源|不新增平台原生 agent_type|角色优先调度顺序|映射变更最小审查要求\" agents/README.md docs/CODEX_COMPAT.md docs/SUBAGENT_GOVERNANCE.md",
                                  "if (Test-Path .git) { git status --short } else { \u0027NO_GIT_REPO\u0027 }"
                              ],
    "verification_result":  {
                                "role_map_covers_required_8_roles":  true,
                                "agent_type_only_default_explorer_worker":  true,
                                "docs_explicitly_state_role_source_vs_mapping_source":  true,
                                "git_repo_detected":  false,
                                "write_scope_violation_detected":  false
                            },
    "deviations_from_dispatch":  [

                                 ],
    "blocked_by":  [

                   ],
    "risks":  [
                  "当前目录未检测到 .git，无法用 git diff 自动证明无越界改动；已通过限定写入清单与逐项核对控制风险。",
                  "reader/reviewer 角色映射已冻结，但对应角色正文文件是否在后续批次补齐仍需主协调器按计划推进。"
              ],
    "follow_up_needed":  [
                             "阶段3再处理模板/schema/编排脚本，不在本阶段提前改造。"
                         ],
    "written_by":  "doc-curator",
    "written_role":  "doc-curator"
}
