{
  "return_packet_id": "RP-B4-VALIDATE-DISPATCH-001",
  "task_id": "contract-first-dispatch-batch3-4-20260403-153206-gtm2",
  "work_order_id": "WO-B4-VALIDATE-DISPATCH-001",
  "status": "completed",
  "summary": "已在 validate-control-plane.ps1 增加复杂任务 dispatch_packet 闸门：复杂 work_order 缺少 dispatch_packet_path、dispatch_packet 文件不存在、或关键字段为空时会报错；并校验 dispatch_packet 与 task/work_order 关联一致性。",
  "changed_files": [
    "skills/global-task-orchestrator/scripts/validate-control-plane.ps1",
    "docs/ai/runs/contract-first-dispatch-batch3-4-20260403-153206-gtm2/return_packets/RP-B4-VALIDATE-DISPATCH-001.json"
  ],
  "planned_files_not_changed": [],
  "verification_commands": [
    "Select-String -Path 'skills/global-task-orchestrator/scripts/validate-control-plane.ps1' -Pattern 'dispatch_packet_path','read_before_write','execution_order','change_spec','verification_focus' -SimpleMatch",
    "powershell -ExecutionPolicy Bypass -File .\\skills\\global-task-orchestrator\\scripts\\orchestrator_ctl.ps1 -Action validate -TaskId contract-first-dispatch-batch3-4-20260403-153206-gtm2 -RepoRoot C:\\Users\\72385\\dev\\ai-harness",
    "powershell -ExecutionPolicy Bypass -File .\\tests\\harness\\control-plane.integration.ps1"
  ],
  "verification_result": "两条工单验证命令均已执行且通过；额外回跑 control-plane.integration.ps1，结果 TOTAL PASS 5，复杂任务缺 dispatch_packet 的 bad path 已被拦截。",
  "deviations_from_dispatch": [],
  "blocked_by": [],
  "risks": [
    "复杂任务判定当前采用 write_paths>3 或 change_spec>1 的黑盒阈值；若后续复杂度定义变化，需要同步更新此闸门规则。"
  ],
  "follow_up_needed": [
    "如后续新增复杂任务判定口径，需补充对应 bad path 测试并更新 validate 规则。"
  ],
  "written_by": "batch4-dispatch-packet-gate-hardener-subagent",
  "written_role": "dispatch-packet-gate-hardener"
}
