{
    "return_packet_id":  "RP-P4-DISPATCH-COMPILER-001",
    "task_id":  "codex-fixed-subagent-delegation-20260407-145034-kewd",
    "work_order_id":  "WO-P4-DISPATCH-COMPILER-001",
    "status":  "completed",
    "summary":  "已完成阶段4委派消息编译器升级：支持通过可选开关注入 role_source_path/role_map_path 角色上下文，并保持默认编译与历史工单兼容。",
    "changed_files":  [
                          "skills/global-task-orchestrator/scripts/control-plane-common.ps1",
                          "skills/global-task-orchestrator/scripts/compile-dispatch-message.ps1",
                          "skills/global-task-orchestrator/assets/prompts/execution-dispatch-template.md",
                          "skills/global-task-orchestrator/assets/prompts/review-dispatch-template.md",
                          "skills/global-task-orchestrator/assets/prompts/work-order-generator.md"
                      ],
    "planned_files_not_changed":  [

                                  ],
    "verification_commands":  [
                                  "powershell -ExecutionPolicy Bypass -File skills/global-task-orchestrator/scripts/compile-dispatch-message.ps1 -RepoRoot C:/Users/72385/dev/ai-harness -Path docs/ai/runs/codex-fixed-subagent-delegation-20260407-145034-kewd/work_orders/WO-P4-DISPATCH-COMPILER-001.json -Json",
                                  "powershell -ExecutionPolicy Bypass -File skills/global-task-orchestrator/scripts/compile-dispatch-message.ps1 -RepoRoot C:/Users/72385/dev/ai-harness -Path docs/ai/runs/codex-fixed-subagent-delegation-20260407-145034-kewd/work_orders/WO-P4-DISPATCH-COMPILER-001.json -IncludeRoleContext -Json",
                                  "powershell -ExecutionPolicy Bypass -File skills/global-task-orchestrator/scripts/validate-control-plane.ps1 -RepoRoot C:/Users/72385/dev/ai-harness -TaskId codex-fixed-subagent-delegation-20260407-145034-kewd -Json"
                              ],
    "verification_result":  {
                                "compile_default_ok":  true,
                                "compile_with_role_context_ok":  true,
                                "role_context_section_only_added_when_enabled":  true,
                                "default_compilation_equals_current_dispatch_message_raw":  true,
                                "validate_control_plane_ok":  true,
                                "validate_errors_count":  0
                            },
    "deviations_from_dispatch":  [

                                 ],
    "blocked_by":  [

                   ],
    "risks":  [
                  "角色上下文注入默认关闭；若后续流程忘记传递 -IncludeRoleContext（或 role 参数覆盖），将继续走历史文本。"
              ],
    "follow_up_needed":  [
                             "阶段5路由升级时，为需要显式角色上下文的派发场景补充 -IncludeRoleContext 调用约定。",
                             "后续新增工单若写入 role_source_path/role_map_path，建议在生成阶段同步声明是否启用角色上下文编译。"
                         ],
    "written_by":  "backend-implementer",
    "written_role":  "backend-implementer",
    "written_at":  "2026-04-07T16:53:19+08:00"
}
