{
    "return_packet_id":  "RP-P5-ROUTING-UPGRADE-001",
    "task_id":  "codex-fixed-subagent-delegation-20260407-145034-kewd",
    "work_order_id":  "WO-P5-ROUTING-UPGRADE-001",
    "status":  "completed",
    "summary":  "已完成阶段5路由升级：orchestrator 与 references 切换为角色优先路由；补齐 reader/reviewer 角色真源、catalog 与 manifest 分发条目，并落地触发与回退矩阵。",
    "changed_files":  [
                          "skills/global-task-orchestrator/SKILL.md",
                          "skills/global-task-orchestrator/references/agent-selection-matrix.md",
                          "skills/global-task-orchestrator/references/dynamic-routing-rules.md",
                          "skills/global-task-orchestrator/references/orchestration-examples.md",
                          "agents/reader.md",
                          "agents/reviewer.md",
                          "agents/README.md",
                          "agents/manifest.json"
                      ],
    "planned_files_not_changed":  [

                                  ],
    "verification_commands":  [
                                  "rg -n \"^## (角色目标|负责范围|不负责|输入|输出|工作规则|停止条件|协作交接)$\" agents/reader.md agents/reviewer.md",
                                  "Get-Content -Raw agents/manifest.json | ConvertFrom-Json | Out-Null",
                                  "rg -n \"reader|reviewer|role|agent_type|role-map|角色优先\" skills/global-task-orchestrator/SKILL.md skills/global-task-orchestrator/references/agent-selection-matrix.md skills/global-task-orchestrator/references/dynamic-routing-rules.md skills/global-task-orchestrator/references/orchestration-examples.md",
                                  "rg -n \"reader|reviewer|角色优先|Catalog|选择原则\" agents/README.md skills/global-task-orchestrator/SKILL.md"
                              ],
    "verification_result":  {
                                "reader_reviewer_8_sections_ok":  true,
                                "manifest_json_parse_ok":  true,
                                "manifest_contains_reader_reviewer":  true,
                                "skill_and_references_role_routing_keywords_present":  true,
                                "agents_readme_catalog_and_selection_updated":  true
                            },
    "deviations_from_dispatch":  [

                                 ],
    "blocked_by":  [

                   ],
    "risks":  [
                  "当前工作目录不可用 git 仓库状态命令，无法通过 git diff 自动证明越界修改；本次仅按 write_paths 定向写入。"
              ],
    "follow_up_needed":  [
                             "阶段6可补充自动化校验：检测 role-first 路由规则与 manifest/role-map 一致性。"
                         ],
    "written_by":  "planner",
    "written_role":  "planner",
    "written_at":  "2026-04-07T17:20:00+08:00"
}
