{
    "work_order_id":  "WO-B3-REVIEW-PROMPT-001",
    "status":  "completed",
    "summary":  "新增 Batch 3 审查型提示词派发模板，压缩输出结构集中在“结论 / findings / 关键依据 / 残余风险”，并指引补测试部分使用 `templates/review_testcases.example.md`，同时按规范完成 return_packet。",
    "changed_files":  [
                          "skills/global-task-orchestrator/assets/prompts/review-dispatch-template.md",
                          "docs/ai/runs/contract-first-dispatch-batch3-4-20260403-153206-gtm2/return_packets/RP-B3-REVIEW-PROMPT-001.json"
                      ],
    "planned_files_not_changed":  [

                                  ],
    "verification_commands":  [
                                  "Test-Path 'skills/global-task-orchestrator/assets/prompts/review-dispatch-template.md'",
     "Select-String -Path 'skills/global-task-orchestrator/assets/prompts/review-dispatch-template.md' -Pattern '结论：通过 / 不通过','findings','关键依据','残余风险','review_testcases.example.md' -SimpleMatch"
                              ],
    "verification_result":  "两条命令均成功执行，模板文件存在且包含要求的关键词。",
    "deviations_from_dispatch":  [],
    "blocked_by":  [],
    "risks":  [],
    "follow_up_needed":  [],
    "written_by":  "LLM review-prompt-compiler",
    "written_role":  "review-prompt-compiler",
    "return_packet_id":  "RP-B3-REVIEW-PROMPT-001",
    "task_id":  "contract-first-dispatch-batch3-4-20260403-153206-gtm2",
    "verification":  [

                     ],
    "next_actions":  [

                     ]
}
